{
  "$schema": "http://json-schema.org/draft-07/schema#",
  "title": "Restaurant",
  "type": "object",
  "required": [
    "_id",
    "name",
    "locations",
    "createdAt",
    "updatedAt"
  ],
  "properties": {
    "_id": {
      "type": "string"
    },
    "name": {
      "type": "string"
    },
    "concept": {
      "type": "string"
    },
    "logo": {
      "type": "string",
      "format": "uri"
    },
    "createdAt": {
      "type": "string",
      "format": "date-time"
    },
    "updatedAt": {
      "type": "string",
      "format": "date-time"
    },
    "locations": {
      "type": "array",
      "items": {
        "type": "object",
        "required": [
          "id",
          "name",
          "address",
          "timezone",
          "isActive",
          "menus"
        ],
        "properties": {
          "id": {
            "type": "string"
          },
          "name": {
            "type": "string"
          },
          "address": {
            "type": "string"
          },
          "timezone": {
            "type": "string"
          },
          "isActive": {
            "type": "boolean"
          },
          "contact": {
            "type": "object",
            "properties": {
              "phone": {
                "type": "string"
              },
              "email": {
                "type": "string"
              }
            }
          },
          "geo": {
            "type": "object",
            "properties": {
              "lat": {
                "type": "number"
              },
              "lng": {
                "type": "number"
              }
            }
          },
          "menus": {
            "type": "array",
            "items": {
              "type": "object",
              "required": [
                "id",
                "name",
                "schedule"
              ],
              "properties": {
                "id": {
                  "type": "string"
                },
                "name": {
                  "type": "string"
                },
                "schedule": {
                  "type": "object",
                  "properties": {
                    "type": {
                      "type": "string",
                      "enum": [
                        "time",
                        "location",
                        "manual"
                      ]
                    },
                    "rules": {
                      "type": "object"
                    }
                  }
                }
              }
            }
          }
        }
      }
    }
  }
}